mysql> show databases;
+--------------------+
| Database           |
+--------------------+
| assignment_2       |
| information_schema |
| mysql              |
| performance_schema |
| sakila             |
| sys                |
| te2                |
| world              |
+--------------------+
8 rows in set (0.00 sec)

mysql> use assignment_2;
Database changed

mysql> show tables;
+------------------------+
| Tables_in_assignment_2 |
+------------------------+
| authors                |
| books                  |
| customer               |
| ordering               |
| publisher              |
+------------------------+
5 rows in set (0.01 sec)

mysql> show create table ordering;
+----------+-----------------------------------------------------------------------------------------------------------------------------------------------------------------------------------------------------------------------------------------------------------------------------------------------------------------------------------------------------------------------------------------------------------------------------------------------------------------------------------------------------------------------------------+
| Table    | Create Table                                                                                                                                                                                                                                                                                                                                                                                                                                                                                                                      |
+----------+-----------------------------------------------------------------------------------------------------------------------------------------------------------------------------------------------------------------------------------------------------------------------------------------------------------------------------------------------------------------------------------------------------------------------------------------------------------------------------------------------------------------------------------+
| ordering | CREATE TABLE `ordering` (
  `order_no` int NOT NULL,
  `cust_no` int DEFAULT NULL,
  `ISBN` int NOT NULL,
  `qty` int DEFAULT NULL,
  `odate` date DEFAULT NULL,
  PRIMARY KEY (`order_no`),
  KEY `cust_no` (`cust_no`),
  KEY `ISBN` (`ISBN`),
  CONSTRAINT `ordering_ibfk_3` FOREIGN KEY (`cust_no`) REFERENCES `customer` (`cust_no`) ON DELETE CASCADE,
  CONSTRAINT `ordering_ibfk_4` FOREIGN KEY (`ISBN`) REFERENCES `books` (`ISBN`) ON DELETE CASCADE
) ENGINE=InnoDB DEFAULT CHARSET=utf8mb4 COLLATE=utf8mb4_0900_ai_ci |
+----------+-----------------------------------------------------------------------------------------------------------------------------------------------------------------------------------------------------------------------------------------------------------------------------------------------------------------------------------------------------------------------------------------------------------------------------------------------------------------------------------------------------------------------------------+
1 row in set (0.00 sec)

mysql> show create table books;
+-------+---------------------------------------------------------------------------------------------------------------------------------------------------------------------------------------------------------------------------------------------------------------------------------------------------------------------------------------------------------------------------------------------------------------------------------------------------------------------------------------------------------------------------------------------------------------------------------------------------------------------+
| Table | Create Table                                                                                                                                                                                                                                                                                                                                                                                                                                                                                                                                                                                                        |
+-------+---------------------------------------------------------------------------------------------------------------------------------------------------------------------------------------------------------------------------------------------------------------------------------------------------------------------------------------------------------------------------------------------------------------------------------------------------------------------------------------------------------------------------------------------------------------------------------------------------------------------+
| books | CREATE TABLE `books` (
  `ISBN` int NOT NULL,
  `title` varchar(20) DEFAULT NULL,
  `unit_price` int DEFAULT NULL,
  `author_no` int NOT NULL,
  `publisher_no` int DEFAULT NULL,
  `pub_year` year DEFAULT NULL,
  PRIMARY KEY (`ISBN`),
  KEY `author_no` (`author_no`),
  KEY `publisher_no` (`publisher_no`),
  CONSTRAINT `books_ibfk_4` FOREIGN KEY (`author_no`) REFERENCES `authors` (`author_no`) ON DELETE CASCADE,
  CONSTRAINT `books_ibfk_5` FOREIGN KEY (`publisher_no`) REFERENCES `publisher` (`publisher_no`) ON DELETE CASCADE
) ENGINE=InnoDB DEFAULT CHARSET=utf8mb4 COLLATE=utf8mb4_0900_ai_ci |
+-------+---------------------------------------------------------------------------------------------------------------------------------------------------------------------------------------------------------------------------------------------------------------------------------------------------------------------------------------------------------------------------------------------------------------------------------------------------------------------------------------------------------------------------------------------------------------------------------------------------------------------+
1 row in set (0.00 sec)

mysql> show create table customer;
+----------+---------------------------------------------------------------------------------------------------------------------------------------------------------------------------------------------------------------------------------------------------------------------------------------------------------------------------------------------------------------------------------------------------+
| Table    | Create Table                                                                                                                                                                                                                                                                                                                                                                                      |
+----------+---------------------------------------------------------------------------------------------------------------------------------------------------------------------------------------------------------------------------------------------------------------------------------------------------------------------------------------------------------------------------------------------------+
| customer | CREATE TABLE `customer` (
  `cust_no` int NOT NULL,
  `cust_fname` varchar(20) DEFAULT NULL,
  `cust_lname` varchar(20) DEFAULT NULL,
  `cust_company` varchar(20) DEFAULT NULL,
  `cust_addr` varchar(20) DEFAULT NULL,
  `city` varchar(15) DEFAULT NULL,
  `cust_phone` varchar(12) DEFAULT NULL,
  PRIMARY KEY (`cust_no`)
) ENGINE=InnoDB DEFAULT CHARSET=utf8mb4 COLLATE=utf8mb4_0900_ai_ci |
+----------+---------------------------------------------------------------------------------------------------------------------------------------------------------------------------------------------------------------------------------------------------------------------------------------------------------------------------------------------------------------------------------------------------+
1 row in set (0.00 sec)

mysql> show create table authors;
+---------+-------------------------------------------------------------------------------------------------------------------------------------------------------------------------------------------------------------------------------------+
| Table   | Create Table                                                                                                                                                                                                                        |
+---------+-------------------------------------------------------------------------------------------------------------------------------------------------------------------------------------------------------------------------------------+
| authors | CREATE TABLE `authors` (
  `author_no` int NOT NULL,
  `author_name` varchar(20) DEFAULT NULL,
  `country` varchar(20) DEFAULT NULL,
  PRIMARY KEY (`author_no`)
) ENGINE=InnoDB DEFAULT CHARSET=utf8mb4 COLLATE=utf8mb4_0900_ai_ci |
+---------+-------------------------------------------------------------------------------------------------------------------------------------------------------------------------------------------------------------------------------------+
1 row in set (0.00 sec)

mysql> show create table publisher;
+-----------+----------------------------------------------------------------------------------------------------------------------------------------------------------------------------------------------------------------------------------------------------------------------------------+
| Table     | Create Table                                                                                                                                                                                                                                                                     |
+-----------+----------------------------------------------------------------------------------------------------------------------------------------------------------------------------------------------------------------------------------------------------------------------------------+
| publisher | CREATE TABLE `publisher` (
  `publisher_no` int NOT NULL,
  `publisher_name` varchar(20) DEFAULT NULL,
  `publisher_addr` varchar(20) DEFAULT NULL,
  `year` int DEFAULT NULL,
  PRIMARY KEY (`publisher_no`)
) ENGINE=InnoDB DEFAULT CHARSET=utf8mb4 COLLATE=utf8mb4_0900_ai_ci |
+-----------+----------------------------------------------------------------------------------------------------------------------------------------------------------------------------------------------------------------------------------------------------------------------------------+
1 row in set (0.00 sec)

mysql> select * from publisher;
+--------------+---------------------+----------------+------+
| publisher_no | publisher_name      | publisher_addr | year |
+--------------+---------------------+----------------+------+
|          201 | Axel Publication    | India          | 2015 |
|          202 | Prakash Publication | India          | 2016 |
|          203 | Dhanpat Rai         | India          | 2000 |
|          204 | Faber and Faber     | Australia      | 2006 |
|          205 | Alfred A.           | USA            | 2004 |
+--------------+---------------------+----------------+------+
5 rows in set (0.00 sec)

mysql> select * from books;
+------+--------------+------------+-----------+--------------+----------+
| ISBN | title        | unit_price | author_no | publisher_no | pub_year |
+------+--------------+------------+-----------+--------------+----------+
|  900 | IP           |        350 |      1111 |          203 |     2000 |
|  901 | A love story |        400 |      1112 |          204 |     2006 |
|  902 | Home         |        320 |      1113 |          205 |     2004 |
|  903 | Red Queen    |        220 |      1114 |          201 |     2015 |
+------+--------------+------------+-----------+--------------+----------+
4 rows in set (0.01 sec)

mysql> select * from customer;
+---------+------------+------------+--------------+-----------+------------+------------+
| cust_no | cust_fname | cust_lname | cust_company | cust_addr | city       | cust_phone |
+---------+------------+------------+--------------+-----------+------------+------------+
|     101 | Arun       | Kumar      | NSA          | India     | Pune       | 101010     |
|     102 | Prashant   | Thakur     | BCCI         | India     | Mumbai     | 102020     |
|     103 | Harish     | Sharma     | CBI          | India     | Delhi      | 103030     |
|     104 | Andrew     | Charter    | CIA          | USA       | Washington | 104040     |
|     105 | Bharat     | Sharma     | Amazon       | India     | Pune       | 105050     |
|     106 | Shubham    | Puri       | Fiserv       | India     | Mumbai     | 106060     |
|     107 | Amitabh    | Kant       | NITI         | India     | Delhi      | 107070     |
|     108 | Ajay       | Kadam      | Google       | India     | Bengaluru  | 108080     |
|     109 | Navneet    | Singh      | MI6          | UK        | London     | 109090     |
|     110 | Surender   | Kumar      | Uber         | India     | Mumbai     | 110101     |
+---------+------------+------------+--------------+-----------+------------+------------+
10 rows in set (0.03 sec)

mysql> select * from books;
+------+--------------+------------+-----------+--------------+----------+
| ISBN | title        | unit_price | author_no | publisher_no | pub_year |
+------+--------------+------------+-----------+--------------+----------+
|  900 | IP           |        350 |      1111 |          203 |     2000 |
|  901 | A love story |        400 |      1112 |          204 |     2006 |
|  902 | Home         |        320 |      1113 |          205 |     2004 |
|  903 | Red Queen    |        220 |      1114 |          201 |     2015 |
+------+--------------+------------+-----------+--------------+----------+
4 rows in set (0.00 sec)

mysql> select * from authors;
+-----------+------------------+-----------+
| author_no | author_name      | country   |
+-----------+------------------+-----------+
|      1111 | Sumita Arora     | India     |
|      1112 | Peter Carey      | Australia |
|      1113 | Toni Morrison    | USA       |
|      1114 | Victoria Aveyard | USA       |
+-----------+------------------+-----------+
4 rows in set (0.00 sec)

mysql> select * from ordering;
+----------+---------+------+------+------------+
| order_no | cust_no | ISBN | qty  | odate      |
+----------+---------+------+------+------------+
|      301 |     101 |  900 |    2 | 2016-08-19 |
|      302 |     105 |  901 |    1 | 2017-06-22 |
|      303 |     102 |  902 |    5 | 2008-01-01 |
|      304 |     109 |  903 |    4 | 2010-11-04 |
+----------+---------+------+------+------------+
4 rows in set (0.00 sec)

mysql> select * from customer where city in ('Pune','Mumbai');
+---------+------------+------------+--------------+-----------+--------+------------+
| cust_no | cust_fname | cust_lname | cust_company | cust_addr | city   | cust_phone |
+---------+------------+------------+--------------+-----------+--------+------------+
|     101 | Arun       | Kumar      | NSA          | India     | Pune   | 101010     |
|     102 | Prashant   | Thakur     | BCCI         | India     | Mumbai | 102020     |
|     105 | Bharat     | Sharma     | Amazon       | India     | Pune   | 105050     |
|     106 | Shubham    | Puri       | Fiserv       | India     | Mumbai | 106060     |
|     110 | Surender   | Kumar      | Uber         | India     | Mumbai | 110101     |
+---------+------------+------------+--------------+-----------+--------+------------+
5 rows in set (0.01 sec)

mysql> select * from customer where cust_fname like 'P%' or cust_fname like 'H%';
+---------+------------+------------+--------------+-----------+--------+------------+
| cust_no | cust_fname | cust_lname | cust_company | cust_addr | city   | cust_phone |
+---------+------------+------------+--------------+-----------+--------+------------+
|     102 | Prashant   | Thakur     | BCCI         | India     | Mumbai | 102020     |
|     103 | Harish     | Sharma     | CBI          | India     | Delhi  | 103030     |
+---------+------------+------------+--------------+-----------+--------+------------+
2 rows in set (0.00 sec)

mysql> select distinct city from customer;
+------------+
| city       |
+------------+
| Pune       |
| Mumbai     |
| Delhi      |
| Washington |
| Bengaluru  |
| London     |
+------------+
6 rows in set (0.01 sec)

mysql> update books set unit_price=unit_price*1.05 where pub_year=2015;
Query OK, 1 row affected (0.02 sec)
Rows matched: 1  Changed: 1  Warnings: 0

mysql> select * from books;
+------+--------------+------------+-----------+--------------+----------+
| ISBN | title        | unit_price | author_no | publisher_no | pub_year |
+------+--------------+------------+-----------+--------------+----------+
|  900 | IP           |        350 |      1111 |          203 |     2000 |
|  901 | A love story |        400 |      1112 |          204 |     2006 |
|  902 | Home         |        320 |      1113 |          205 |     2004 |
|  903 | Red Queen    |        231 |      1114 |          201 |     2015 |
+------+--------------+------------+-----------+--------------+----------+
4 rows in set (0.00 sec)

mysql> select * from customer;
+---------+------------+------------+--------------+-----------+------------+------------+
| cust_no | cust_fname | cust_lname | cust_company | cust_addr | city       | cust_phone |
+---------+------------+------------+--------------+-----------+------------+------------+
|     101 | Arun       | Kumar      | NSA          | India     | Pune       | 101010     |
|     102 | Prashant   | Thakur     | BCCI         | India     | Mumbai     | 102020     |
|     103 | Harish     | Sharma     | CBI          | India     | Delhi      | 103030     |
|     104 | Andrew     | Charter    | CIA          | USA       | Washington | 104040     |
|     105 | Bharat     | Sharma     | Amazon       | India     | Pune       | 105050     |
|     106 | Shubham    | Puri       | Fiserv       | India     | Mumbai     | 106060     |
|     107 | Amitabh    | Kant       | NITI         | India     | Delhi      | 107070     |
|     108 | Ajay       | Kadam      | Google       | India     | Bengaluru  | 108080     |
|     109 | Navneet    | Singh      | MI6          | UK        | London     | 109090     |
|     110 | Surender   | Kumar      | Uber         | India     | Mumbai     | 110101     |
+---------+------------+------------+--------------+-----------+------------+------------+
10 rows in set (0.00 sec)

mysql> delete from customer where city='Pune';
Query OK, 2 rows affected (0.03 sec)

mysql> select * from customer;
+---------+------------+------------+--------------+-----------+------------+------------+
| cust_no | cust_fname | cust_lname | cust_company | cust_addr | city       | cust_phone |
+---------+------------+------------+--------------+-----------+------------+------------+
|     102 | Prashant   | Thakur     | BCCI         | India     | Mumbai     | 102020     |
|     103 | Harish     | Sharma     | CBI          | India     | Delhi      | 103030     |
|     104 | Andrew     | Charter    | CIA          | USA       | Washington | 104040     |
|     106 | Shubham    | Puri       | Fiserv       | India     | Mumbai     | 106060     |
|     107 | Amitabh    | Kant       | NITI         | India     | Delhi      | 107070     |
|     108 | Ajay       | Kadam      | Google       | India     | Bengaluru  | 108080     |
|     109 | Navneet    | Singh      | MI6          | UK        | London     | 109090     |
|     110 | Surender   | Kumar      | Uber         | India     | Mumbai     | 110101     |
+---------+------------+------------+--------------+-----------+------------+------------+
8 rows in set (0.00 sec)

mysql> select author_name, country from authors where country="India" union select author_name, country from authors where country="Australia";
+--------------+-----------+
| author_name  | country   |
+--------------+-----------+
| Sumita Arora | India     |
| Peter Carey  | Australia |
+--------------+-----------+
2 rows in set (0.02 sec)

mysql> select * from books;
+------+--------------+------------+-----------+--------------+----------+
| ISBN | title        | unit_price | author_no | publisher_no | pub_year |
+------+--------------+------------+-----------+--------------+----------+
|  900 | IP           |        350 |      1111 |          203 |     2000 |
|  901 | A love story |        400 |      1112 |          204 |     2006 |
|  902 | Home         |        320 |      1113 |          205 |     2004 |
|  903 | Red Queen    |        231 |      1114 |          201 |     2015 |
+------+--------------+------------+-----------+--------------+----------+
4 rows in set (0.00 sec)

mysql> select max(unit_price) "Maximum Price" from books;
+---------------+
| Maximum Price |
+---------------+
|           400 |
+---------------+
1 row in set (0.01 sec)

mysql> select title from books where unit_price between 300 and 400;
+--------------+
| title        |
+--------------+
| IP           |
| A love story |
| Home         |
+--------------+
3 rows in set (0.00 sec)

mysql> select title, unit_price, pub_year from books order by pub_year desc;
+--------------+------------+----------+
| title        | unit_price | pub_year |
+--------------+------------+----------+
| Red Queen    |        231 |     2015 |
| A love story |        400 |     2006 |
| Home         |        320 |     2004 |
| IP           |        350 |     2000 |
+--------------+------------+----------+
4 rows in set (0.01 sec)

mysql> select title, author_no, publisher_no from books where pub_year in (2000, 2004, 2006);
+--------------+-----------+--------------+
| title        | author_no | publisher_no |
+--------------+-----------+--------------+
| IP           |      1111 |          203 |
| A love story |      1112 |          204 |
| Home         |      1113 |          205 |
+--------------+-----------+--------------+
3 rows in set (0.00 sec)

mysql> select * from publisher;
+--------------+---------------------+----------------+------+
| publisher_no | publisher_name      | publisher_addr | year |
+--------------+---------------------+----------------+------+
|          201 | Axel Publication    | India          | 2015 |
|          202 | Prakash Publication | India          | 2016 |
|          203 | Dhanpat Rai         | India          | 2000 |
|          204 | Faber and Faber     | Australia      | 2006 |
|          205 | Alfred A.           | USA            | 2004 |
+--------------+---------------------+----------------+------+
5 rows in set (0.02 sec)

mysql> select a.publisher_name from publisher a where a.year =2015 and a.publisher_name in (select b.publisher_name from publisher b where b.year =2016);
Empty set (0.01 sec)

mysql>